name,description,latitude,longitude,category
Wild Horse Pass Casino (south of Phoenix)Free RV camping in the RV lot around back,"Wild Horse Pass Casino (south of Phoenix)
Free RV camping in the RV lot around back. No registration necessary. 
You're parking with the big rigs, so it might get a little noisy. ",33.280039,-111.971349,Free Camping
Very beautiful location on on the the road heading up to oak grove campground,Very beautiful location on on the the road heading up to oak grove campground. It is on the base of Pine Mountain in the Dixie National Forest. There are several primitive campsites along the road with no fees.  There is enough room for a small RV and a couple other vehicles at this particular site.  Not very far from I-15.  Just take the Leeds exit and then turn on the road that has a sign to Silver Reef. Continue following the road to the site.  only 30 minutes from St. George. Lots of beatiful hiking and scenery abound. ,37.272756,-113.388383,Free Camping
Southeast Section Scaddan Wash,"Southeast Section Scaddan Wash.
BLM 14 day limit area
Free and legal
Quartzsite, AZ off of I-10 exit 19.
South on 95 until it comes to a dead end. Turn left and drive for less than a mile. Scaddan Wash is on the right. There are other BLM camping areas throughout the area. Maps are on boards at the entrances. 
With easy access to Quartzsite, and miles of flat, open land. There are a few shade trees, but they get claimed quickly. It gets brutally hot here. Come prepared. You can see the highway. The noise is very reasonable, though.",33.665391,-114.187506,Free Camping
Sherburne Wildlife Management Area,"Sherburne Wildlife Management Area. Tent and R/V camping are free, at the southern campsite in the WMA with a self clearing permit that can be obtained at any of the area's Information Centers (an Information Center is located at the campsite). The site is secluded though you may a couple of neighbors during peak hunting and fishing seasons. A few of the WMA's activities include camping, hiking, sightseeing, boating, horseback riding trails and ATV trails. With proper license hunting, trapping and fishing is possible. The site is down a dirt road and over the top of a levee so access to the site may be difficult if the weather is or has been bad (this is a Louisiana swamp), 4wd vehicle may be needed. From I-10 take the Whiskey Bay Exit on the Atchafalaya Basin Bridge. Head north on 975 for approximately 9 miles.    ",30.457717,-91.728994,Free Camping
Joe Skeen BLM Camping,"Joe Skeen BLM Camping. This is easy to find off of 117. It's set up like a regular campground with a host, and everything. Each site has a little awning over a picnic table. There's a pit toilet available. This is a fee free are.",34.941214,-107.823539,Free Camping
El Malpais National Conservation Area,"El Malpais National Conservation Area. Right off of 117, just below El Mapais National Monument.",34.702991,-108.028485,Free Camping
"Goumaz campground, a USFS campground in Lassen National Forest","Goumaz campground, a USFS campground in Lassen National Forest.  Previously a fee was required to camp here, but when I was there the fee box was tapped up and there was no mention of a fee, so it's now free.  About 6 campsites with tables, and running water!  Right in the middle of the Bizz Johnson trail, an old railroad line converted to a hiking and biking trail.  One day we rode down and back to Susanville, and the next day up to Westwood and back.  At the most the trail is a 3% grade, so kids can easily do part of the it.  ",40.413,-120.86267,Free Camping
Open 14 day limit camping with hills and offroading and expansive flatland available for any kind of camper,"Open ""14 day limit"" camping with hills and offroading and expansive flatland available for any kind of camper. It's called The Dome Rock Mountain Area, in the La Posa LTVA. Way to hot in the summer reaching 110 fairly frequently, but the other 3 seasons are optimal. Anyway, it's free and super easy to get to off the Dome Rock exit off of I-10. You can see it all from the highway!",33.644973,-114.333601,Free Camping
"Birkhead Mountains Wilderness in Uwharrie National Forest (USFS) has multiple trail heads, and this one off of Lassiter Mill Road is far less used than the nicer one closer to NC 49","Birkhead Mountains Wilderness in Uwharrie National Forest (USFS) has multiple trail heads, and this one off of Lassiter Mill Road is far less used than the ""nicer"" one closer to NC 49. As long as you're 300 feet away from the trail head, or 100 feet off of any marked trail, you can camp without being bothered. Even on busy days, the trails at this end are very sparse in terms of users. The entry road is a little rough, so I wouldn't recommend trying to drive anything too large to the trail head. I have personally driven a sports car into there many times, so it's not that bad, just a decent uphill grade.",35.59015,-79.94873,Free Camping
Free camping near the Shirley Site  Marshall Pass road,"Free camping near the Shirley Site / Marshall Pass road.  Plenty of spots, very heavily used on summer weekends by ATVs and mountain bikers.",38.415468,-106.137457,Free Camping
"Located a few miles north of the east entrance to Valley of Fire State Park on 169, this huge mesa is known as Snowbird Mesa or Poverty Flats depending on your point of view","Located a few miles north of the east entrance to Valley of Fire State Park on 169, this huge mesa is known as ""Snowbird Mesa"" or ""Poverty Flats"" depending on your point of view.  There is some debate as to whether it is BLM land or belonged to a defunct mining company, but there are no signs limiting stays and there appear to be some long term residents. There are a few stone fire rings and plenty of stones to make more.  There can be dozens to hundreds of rigs depending on the season.  There are several roads in to the east side which goes back a good ways. There is only room for a few rigs on the west side but some people prefer that view enough to put up with the proximity to the road.  The town of Overton is a few miles up the road, with a Mavericks gas station, fast food, supermarkets and bars and so on.  I had great ATT 4G service there but no TMobile at all.",36.481223,-114.450734,Free Camping
Near Emerald Isle NC on the White Oak River,"Near Emerald Isle NC on the White Oak River.  Long Point Landing. Enter from Highway 58 at brown sign FR120 between Maysville and Swansboro N 34.822 W 77.15.  Three tent sites with pit toilet. Sites are very close together.
good spot for kayaking and canoes. People sometimes fish there so may be crowded. Hard to get a spot in the summer. Narrow dirt road so no large vehicles.  

Camping also available at Haywood Landing which you access off of this same road then FR146 but better suited for vehicle camping. Also, lots of traffic at the boat launch. Same narrow dirt road. 
USDA-Forest Service, Croatan National Forest",34.798,-77.1782,Free Camping
"Exit I-70 at Rabbit Valley and head south on dirtgravel road to to Knowles Canyon Overlook, located in Mc Innis Canyons National Conservation Area","Exit I-70 at Rabbit Valley and head south on dirt/gravel road to to Knowles Canyon Overlook, located in Mc Innis Canyons National Conservation Area. About 16 miles.  Six BLM sites with a nice view of the Colorado River below. I did see a tent camper trailer out there but it's really not suitable for motor homes. A nice hike is back up the road for the trail head going down Knowles Canyon.",39.13867,-109.02635,Free Camping
Exit I-70 at  Rabbit Valley and head north towards the Walk Through Time trailhead,Exit I-70 at  Rabbit Valley and head north towards the Walk Through Time trailhead. Turn left and follow the gravel road up a fairly steep ascent to the top of the ridge where  there are least 6 sites on BLM land. I did see a large RV up there but I'm not sure it's suitable  for an inexperienced driver. Would make a good free stopover between Grand Junction and Moab. Disadvantage is you're still relatively close to I-70 and and get some traffic noise. ,39.19328,-109.02747,Free Camping
USFS,"USFS.  This is the Neches Bluff Overlook area just off of highway 21 in Davy Crockett National Forest.  It is the Northern trailhead for the 20 mile 4C trail, which ends in Ratcliff Lake Recreation Area on highway 7.  Ratcliff is a paid recreation area, but this northern site is completely free for camping and day use and includes at least one geocache.  There's a decent view of the Neches River bottom from a platform near the restroom.  This area is also very popular with hunters during deer season, so be aware if you're not there to hunt at that time.  Some nearby towns are Crockett, Lufkin, and Ratcliff, where the Ranger Station is located.",31.5666705,-95.1633685,Free Camping
Willow Creek Reservoir,"Willow Creek Reservoir. This is a great place to go camping and fishing. There are no ""improved"" campgrounds here. Only primitive camping. I've seen tents set up here and fire rings. The road to the reservoir is a dirt road in decent shape. Any type of vehicle should be able to make it here in good weather conditions. I wouldn't try it in foul weather as the roads can get very soft very quickly.",41.224493,-116.53778,Free Camping
Chimney Reservoir,"Chimney Reservoir. The roads to this reservoir are in good repair as long as you are traveling in good weather. There is an ""improved"" campground here with grills, restrooms, and picnic tables. The campgrounds are completely free though. The reservoir is supposed to be good for fishing for largemouth bass, walleye, crappie, channel catfish, and carp, though I didn't have any luck when I fished there. The water is not very clear. The visibility is probably about an inch or two.",41.394782,-117.176054,Free Camping
There are campgrounds along the main road here,"There are campgrounds along the main road here. I believe the campgrounds are provided and maintained by the Forest Service though they are primitive. A creek does flow along the campgrounds, though the water level varies dependent on the time of year. I was there in early July and the water in the creek was just a trickle with areas of pooled water. ",41.689627,-115.503306,Free Camping
Black Kettle National Grassland at Dead Indian Lake,"Black Kettle National Grassland at Dead Indian Lake. A beautiful spot with about a dozen camp sites. A few of which have full sun all day and great access to the lake. The others, closer to the entrance, are very well shaded with great hammock spots. Both locations have large, flat, grassy areas perfect to pitch a tent, with restrooms close by.

Free, legal, and public year around with a 14 day limit on all stays.",35.745232,-99.714689,Free Camping
City of Silver Bay MN offers a municipal dump station and RV parking area adjacent to a public scenic overlook,"City of Silver Bay MN offers a municipal dump station and RV parking area adjacent to a public scenic overlook. There is a donation box but no charge to use the dump station or designated RV parking area. The area is quiet and unlit and located within easy walking distance of the city which offers a nice shopping center, public library with free wifi, 2 service stations etc.
Located less than 1 mile off Hwy 61 in downtown Silver Bay, follow the signs for the RV dump station.",47.294275,-91.270721,Free Camping
City of Burnsville MN allows overnight RV parking across from its City Hall located at 100 Civic Center Drive,City of Burnsville MN allows overnight RV parking across from it's City Hall located at 100 Civic Center Drive. Park in the large lot adjacent to the ICE CENTER. There is a free dump station at nearby Lakeville MN at 18400 Ipava Ave. Nearby Crystal Beach in Burnsville is open until 10PM and has restrooms and outside showers (free).,44.759472,-93.264556,Free Camping
City of Wabasha MN has posted 72 Hour parking for no charge,"City of Wabasha MN has posted 72 Hour parking for no charge. Across from Schells Super Value at 221 Hiawatha Dr W 55981
Just off Hwy 61, this is a large flat secure place to park for up to 3 days at no charge. Wabasha also has a City campground(fee) which may offer dump station for a small fee. Wabasha is Minnesota's oldest river town with great shopping and dining nearby (walkable).",44.378271,-92.036793,Free Camping
"The location on the street is 5810 River RdRenfrew, Ontario Canada","The location on the street is 5810 River Rd
Renfrew, Ontario Canada. There is only a garbage can there.

",45.5505858,-76.6684589,Free Camping
A dispersed camping area just off the paved road (China Hat) on Forest Service land,"A dispersed camping area just off the paved road (China Hat) on Forest Service land. Just a couple miles south of Bend. Primitive, but very convenient and accessible.",43.9842736,-121.3050659,Free Camping
Dispersed camping off of the forest service road (Paulina-East Lake Rd),"Dispersed camping off of the forest service road (Paulina-East Lake Rd). Easily accessible, primitive and free.",43.71457912,-121.4152484,Free Camping
My favorite urban boondocking site,My favorite urban boondocking site. Been here 2 years you need to move a little every 24 hours,61.1967593,-149.8817177,Free Camping
Burraston Ponds Free Camp Ground with a rope swing and seasonal pit toilets,Burraston Ponds: Free Camp Ground with a rope swing and seasonal pit toilets. Fishing. No running water.,39.794819,-111.866913,Free Camping
Privately owned land being turned into a campground in owners spare time,Privately owned land being turned into a campground in owners spare time. 16 campsites are cleared but dry camping only as of jan. 2015. Water and dump station are available.     Call owner for availability at 910-486-0085.  Ask for Mike.   Campground is located 12 miles west of  I-95 on 17 secluded acres. ,34.85526868,-78.79975496,Free Camping
Privately owned land located in the sand hills of North Carolina,Privately owned land located in the sand hills of North Carolina.  the campground is located 12 miles east of I-95/Fayetteville.  The land is being turned into a 55 site campground still under construction.  16 campsites are available for dry camping.  Water and dump pipe are available (using honey wagon).  Since it is not in business please call ahead to verify availability at 910-486-0085.  ,34.854905,-78.799483,Free Camping
"Falcon Heights County ParkHas hot showersome sites have grills, some have picnic tableshas water to each site, no sewer hookups, no electricityelectricity available in Pavillion for charging electronicsNo limit on length of stay,sites mowed once a year, campers must keep site cut","Falcon Heights County Park
Has hot shower
some sites have grills, some have picnic tables
has water to each site, no sewer hookups, no electricity
electricity available in Pavillion for charging electronics
No limit on length of stay,
sites mowed once a year, campers must keep site cut",26.5676076,-99.1267162,Free Camping
Sam Houston National Forest,"Sam Houston National Forest. 
Multiple spots along Kelly's Pond Road. 
Free for up to 14 days. $5/day fee to use surrounding trails. Trail information at end of road. 
I-45 to FM1375W. Cross Lake Conroe. Look for sharp left on 204. Kelly's Pond Rd ahead on right. 

Camped here 2/28/15. Good road condition. VW Jetta handled it no problem. Others camping in pulloffs along road too. ",30.51055,-95.662125,Free Camping
Kaibab National Forest Tusayan District,"Kaibab National Forest Tusayan District. Approaching Grand Canyon National Park on rt 64 first right turn after first traffic circle entering Tusayan route 302. Sites past 302a-e more private. 302 wide, graveled, smaller side roads vary, most good. Wouldn't need 4-wheel on most unless really bad weather. Could get big rigs in some spots. Ranger station just past second circle. 6-7 miles to GC visitor center. Mile or less to Tusayan, which has free shuttles to GC in season. Fly in ointment -- right under tourist helicopter flight path. Also, enter Park, continue toward Desert View, turn on rt 310, just past Grandview Overlook. Will exit Park, re-enter Kaibab NF. Lots of sites. The Arizona Trail crosses nearby. ",36.03721605,-112.107132,Free Camping
Mall Of America,Mall Of America. In the North Parking Lot they allow free overnight stays.  Bathrooms inside during normal business hours.,44.85591,-93.242083,Free Camping
"Hidden Valley RV Park is a pay RV Park with a few sites on the parks edge for free, one night stays for RVs only, no tents","Hidden Valley RV Park is a pay RV Park with a few sites on the parks edge for free, one night stays for RV's only, no tents.  There are no facilities included so you must be self contained. Quiet and secure location. Must call in advance and arrive before 6pm in most cases. Sites not available after heavy rains since they are in a field. Only 15 minutes to downtown San Antonio. Access on a very decent gravel road (Campground Road)
210-623-6737
http://hiddenvalleyrvpark.com
info@hiddenvalleyrvpark.com",29.2915289,-98.6175619,Free Camping
Davis Dam Camp,"Davis Dam Camp is located just below  Davis Dam  on the Arizona side of the Colorado River. This is a picturesque area with excellent views of the dam, sunsets, and the surrounding mountains. This park accomodates both the day use, as well as the long-term visits, and even includes two cottages available for daily rental. Features include a 3-lane boat ramp, 157 full service hookups, 30 hookups with water and electricity, 5 restrooms with shower facilities, a laundry facility, dump station, group picnic area with ramada, a large open area for dry camping, and a day use area with 4 ramadas. A boat and RV storage facility is also available. For those with special needs there is an accessible fishing pier, accessible boat embarcation ramp, and 10 accessible ramada sites. Davis Dam Camp was built to house the workers who constructed Davis Dam. A few of the original camp buildings remain, although they have been altered. A local museum is adjacent to the park and an important petroglyph site is within the boundaries of the park.",33.9933802,-109.7587106,Camping
Herd Lake Campground,This is a single campsite located 10 miles southeast of the East Fork Road on Herd Lake Road. The site is located about 1 mile west of Herd Lake and is tucked down below the road and next to Herd Creek. A trail provides non-motorized access to the lake. \r\nAmenities include: \r\n1 campsite with picnic table and fire ring \r\n1 vault toilet; Trail head to Herd Lake,44.09495,-114.18173,Camping
Upper Big Bend Camping Area,"Nestled between Scenic Utah Highway 128 and the Colorado River, the Upper Big Bend Campground is popular with climbers visiting the  Big Bend Bouldering Area a short walk away.\r\n Upper Big Bend Campground is located 8 miles from the junction of U.S. Highway 191 and Utah Highway 128. Upper Big Bend is suitable for tent camping. Campsites are available on a first-come, first served basis.  There is no water available.  \r\n\r\n Fee: $10.00 per vehicle Number of campsites: 8 Toilets: Yes\r\n For a photo and a brief description please visit:  http://www.blm.gov/ut/st/en/fo/moab/recreation/campgrounds/highway_128/Upper_Big_Bend.html",38.64933,-109.48819,Camping
Indian Crossing Campground,Elevation 5700 ft. 22 campsites on the Green River. John Jarvies chose to establish his homestead and business here because of the natural crossing across the Green River. Explore the historic buildings and relive the wild west.,40.5356,-109.1048,Camping
Corral Creek Campground,"This is a free site with 6 campsites at 7,200 foot elevation with vault toilet, day use parking, and a foot trail to wade fishing. Each campsite has a picnic table, fire ring/grill at most sites, parking space, and no pull-throughs. The main attraction at this site is fishing and floating on the North Platte River. An abundance of wildlife can be found in the area.  Typical use season is from June 1st through November 15th depending on winter conditions.",41.26152,-106.57248,Camping
Teton Reservoir Campground,"Set in the rolling sage grasslands of the Great Divide Basin, this reservoir becomes a watery oasis under the bright summer skies. Fishing for trout in the reservoir and surrounding streams is good; this is also a popular non-motorized water sports area.\r\n\r\nThis is a free site with 5 campsites, vault toilets, boat ramp, and day use parking. Campsites have picnic tables, fire ring/grills, and parking spurs with no pull-throughs.  No horses allowed in campground. Typical use season is from June 1st through November 15 because access roads become impassable after heavy rain and snow belt wherein they get extremely muddy.",41.60278,-107.25483,Camping
Weeping Rock Campground,"A fine getaway for anglers boaters and birdwatchers. This area was once a gathering place for mountain men, and is now a haven for birds and wildlife. Trout and kokanee salmon live in this area of the Green River, and since the area is restricted to motorboats, the fishing is always good.  Free site, facilities include toilets, picnic sites, and fishing access to the Green River.\r\n\r\nThis site is located near historic resources. Please do not collect or damage resources.",42.02075,-110.04957,Camping
OHAVER LAKE,"Overview OHaver Campground, located on the shores of OHaver Lake, attracts many campers for fishing, bird watching and canoeing on the calm, pleasant lakes. During peak season, interpretive programs are offered most weekends. Nearby mountain biking and hiking opportunities are also available.  Campers can venture on a trip to part of the popular Colorado Trail. The multi-purpose trail extends for 487 miles from Denver to Durango, with altitude variations ranging from 5,500 to 13,300 feet.  Natural Features: Campsites have limited understory and sites are situated close to one another. OHaver sits at an elevation of 9,200 feet, in a forest of ponderosa pine and aspen.  Ponderosa pines provide a fresh vanilla scent in the mountain air and aspens please visitors with golden foliage displays in autumn. Nearby OHaver Lake spans 15 acres. Recreation: Anglers can use the accessible fishing pier or a paddle boat to seek rainbow and brook trout on OHaver Lake.  Facilities: Vault toilets and drinking water from hand pumps are provided. Trash collection service is provided and parking aprons are dirt. A campground host is onsite.  Nearby Attractions: Monarch Pass is a highly enjoyed scenic drive, offering impressive 360 degree views of Colorados Sawatch Range.",38.4277777778,-106.143055556,"Camping, Horseback Riding"
MEADOWS GROUP CAMPGROUND,"Overview Meadows Group Campground offers a wonderful opportunity for groups to enjoy the great outdoors. Located just 45 miles south of Denver near the town of Buffalo Creek, Colorado, the campground provides easy access to trout fishing, hiking and mountain biking.  Natural Features: The campground sits at an elevation of 7,400 feet in the Front Range of the Rocky Mountains. Temperatures are generally mild. About 67 miles south is Pikes Peak at an altitude of 14,110 feet. It is heralded as the easternmost mountain peak over 14,000 feet in the United States.  Recreation: Several trailheads for mountain biking, hiking and horseback riding are within a half mile radius of the campground. The Buffalo Creek mountain bike area and the Lost Creek Wilderness Area can be accessed from the campground via the Colorado Trail. Buffalo Creek is a popular fishing area for brook trout. Facilities: Two group campsites are available and each one fits up to 150 campers. Accessible picnic tables and vault toilets are onsite. A communal water hydrant is available but it is recommended that campers bring their own drinking water. Firewood is available at Buffalo Campground, a half-mile east on Forest Road 550. Nearby Attractions: Head to Wellington Lake or hike up one of the many peaks like Little Scraggy Peak.",39.3319444444,-105.316666667,"Camping, Horseback Riding"
BUCKBOARD CROSSING,"Overview Buckboard Crossing Campground is located on the far northwest shore of Flaming Gorge Reservoir at an elevation of 6,100 feet. Boating, fishing and water skiing are popular activities. Natural Features: The campground is situated in a high desert landscape with sagebrush and a few scattered trees. Natural shade is minimal. Typical weather ranges from warm days to cool nights. Recreation: Fishing, boating, canoeing, water skiing and swimming are popular activities on the lake. Campers are offered the convenience of an adjacent boat ramp, marina and fish cleaning station. Buckboard Marina has boat rentals, fuel, slips, fishing licenses, bait and groceries. Facilities: The campground consists of 66 single-family campsites, most of which can be reserved. Several sites in Loop A have electrical hookups. Most sites have a shade cabana, picnic table and campfire ring. Some sites have grills and/or fire rings. Flush toilets, drinking water and showers are provided. Non-campers can use the shower facilities for a small fee. A dump station is located on-site.  Nearby Attractions: Flaming Gorge Dam offers guided tours of the working hydroelectric plant and the dam itself; The adjacent visitor center contains area history exhibits.",41.2494444444,-109.601388889,"Camping, Horseback Riding"
