name,description,latitude,longitude,category
LONG MEADOW GROUP,"Overview Long Meadow Group Campground is a remote facility within Sequoia National Forest, in the southern portion of Giant Sequoia National Monument. The area is named for the giant sequoia, the worlds largest tree, which grows in more than 30 groves on the forests lower slopes.  Natural Features: Sequoia National Forest comprises about 1.1 million acres. Elevations range from about 1,000 to 12,000 feet, creating precipitous canyons and mountain streams with spectacular waterfalls such as Salmon Creek Falls and Grizzly Falls. The campground sits at an elevation of 6,400 feet, near trails that wind through giant sequoia groves, climb up mountains and meander along wild rivers. Recreation: Touring the Sequoia National Monument is the areas most popular activity. Hikers enjoy the Trail of a Hundred Giants as it wanders through the Long Meadow Giant Sequoia Grove. Other points of interest within the southern section include the Belknap Grove and the Freeman Grove The northern portion of the monument is a short drive away, where visitors can view the Boole Tree, which is the largest tree on the National Forest system. Indian Basin Grove is also located in this area.  Facilities: The group campground is configured for up to 36 people and up to 5 vehicles. No hookups are available. Vault toilets are provided. This is a remote facility with no nearby conveniences. Nearby Attractions: Sequoia National Monument offers numerous hiking trails through scenic sequoia groves.  The Giant Sequoia Mercantile offers a wide variety of books, maps, gifts, local art, camping supplies and other merchandise that will serve to make trips to the monument more memorable.",35.9791666667,-118.580555556,"Camping, Horseback Riding"
REDWOOD MEADOW,"Overview This USFS campground is located about 50 miles east of Springville, CA, in the Tule Ranger District of the Sequoia National Forest.  There are fishing and hiking opportunities nearby.  Trail of 100 Giants is nearby.  Approximate season dates are 5/15 to 11/01.   Giant Sequoia Mercantile Now Open In Springville, CA",35.9777777778,-118.591666667,"Camping, Horseback Riding"
CLACKAMAS LAKE,"Overview Clackamas Lake Campground is a great camping destination, especially when nearby Timothy Lake sites are full.  The lake is small and shallow.  The facility is located in the Clackamas Lake Historic District in Mt. Hood National Forest. It provides access to fishing, swimming and leisurely boating, as well as a number of trails and historic points along the way. Natural Features: The campground is nestled in a heavily wooded forest of pine trees, with partial views of Oregons highest peak. A lush, green understory provides some privacy between campsites. The campground is near the shores of 3-acre Clackamas Lake, and just three miles from larger Timothy Lake. It is situated at an elevation of about 3,400 feet. Recreation: Clackamas Lake is a great place for fishing, swimming and non-motorized boating. Anglers can expect a catch of cutthroat, brook, rainbow or German brown trout. A variety of wildlife make its home in the area as well.  Nearby Timothy Lake provides opportunities for picnicking and water-related recreation, including use of power boats. The Clackamas Lake Ranger Station Historic District is less than a mile from the campground. It is a series of structures and cabins built to house Forest Service workers in the early 1900s. Rustic architecture and the historic nature of the buildings and the surrounding area, draws thousands of tourists each year. It is a must-see while staying at the campground. Hiking, mountain biking and horseback riding are also popular activities. The 2.2-mile Miller Trail begins in the campground and connects to the Pacific Crest Trail, which extends more than 2,650 miles, from Canada to Mexico. Additional trails, to scenic Little Crater Lake and to the Mt. Jefferson Wilderness, are also available in the area. Facilities: The campground offers single-family sites for tent and RV camping. There are 11 equestrian sites in the 49-site campground with corrals.  Those sites are intended for equestrians, but may be used by others.  Some sites are available on a first-come, first-served basis. Each site is equipped with a table and campfire ring with grill. Accessible vault toilets and drinking water are provided. Utility hookups are not available. Parking surfaces are dirt and gravel. Nearby Attractions: The campground is less than 40 miles from Mt. Hood, where a historic lookout provides scenic views of the snow-capped mountain. Hiking and year-round skiing is available.",45.0958333333,-121.747222222,"Camping, Horseback Riding"
SHIRTTAIL CREEK,"Overview Shirttail Campground is located on the north shore of Sugar Pine Reservoir, in the Tahoe National Forest, 15 miles from Foresthill. Visitors enjoy the area for its fishing, canoeing and hiking opportunities. Natural Features: Sugar Pine Reservoir covers 160 acres at an elevation of 3600 feet. The campground lies above the north shoreline, in a forest of manzanita and ponderosa pine. Summertime temperatures are warm during the day and cool at night. Recreation: Fishing, canoeing, swimming and boating are popular activities on the reservoir. A paved, non-motorized trail circles the campground and connects to the day use area and Giant Gap Campground. The North Fork of the American River is nearby, with additional fishing and swimming. Many miles of hiking, biking and off-road vehicle trails are in the surrounding area.  Facilities: The campground offers several single- and double-family campsites, a few of which are accessible. Picnic tables, campfire rings and grills are provided, as are vault toilets and drinking water. Firewood is available for purchase from the host.",39.1444444444,-120.784722222,"Camping, Jeep Trails"
North Fork Elk Group Camp,"Overview North Fork Elk Group sits alongside the Cispus River in the North Fork Campground, shaded by a dense canopy of pine, fir and cedar trees. The facility is typically open from mid-May through late September, and is one one of three group sites within the campground. North Fork is situated between three of Washingtons most impressive mountains: Mount St. Helens, Mt. Adams and Mt. Rainier. The variety of recreational activities and the diverse natural beauty draws many visitors to this area.  Natural Features: North Fork is part of the Cowlitz Valley Ranger District, which is located in the northernmost portion of the Gifford Pinchot National Forest. Located in southwest Washington state, the Gifford Pinchot National Forest encompasses 1.3 million acres and includes the 110,000-acre Mount St. Helens National Volcanic Monument established by Congress in 1982. This Ranger District manages four Wilderness Areas including the Goat Rocks Wilderness, Glacier View Wilderness, Tatoosh Wilderness and William O. Douglass Wilderness. Major River drainage includes the Cowlitz River, Clear Fork of the Cowlitz, and the Cispus River. A variety of wildlife may be spotted in this area, including elk, deer and bears. Recreation: North Fork Elk Group makes a great base camp for a variety of activities. Hikers, mountain bikers and OHV riders can access the nearby multi-use Valley Trail. From this trail, OHV riders can enjoy a network of over 50 miles of OHV trails.  The North Fork Loop trail is open to foot traffic and can also be accessed in this area.  Anglers can fish the Cispus River for brook trout, steelhead and salmon. Facilities: This tent-only site has six tent pads and will accommodate up to 30 people. Its secluded with gated access and offers picnic tables, grills and drinking water. There is a host on-site and firewood is available for sale. Nearby Attractions: Randle is the closest town to North Fork, and it offers access to the Windy Ridge Lookout at Mount St. Helens.  Adventurous hikers who want to enjoy some spectacular views may be interested in the Tongue Mountain Trail, which climbs to an elevation of 4,838 feet.",46.4525,-121.788888889,"Ohv, Atv, Camping, Horseback Riding"
UPPER LITTLE TRUCKEE,"Overview Upper Little Truckee Campground is located on Highway 89, about 12 miles north of Truckee. Its location makes it a great base camp for a variety of recreational activities, including fishing, hunting, hiking and biking. Natural Features: The campground is situated on the banks of the Little Truckee River, at an elevation of 6,200 feet. A forest of lodgepole pine, aspen and juniper trees covers the area, offering partial shade. A few sites overlook the river. Recreation: Fishing for rainbow and brown trout in the Little Truckee River is a popular activity enjoyed by visitors to the area. The surrounding area offers hiking and biking trails. Facilities: The campground offers single-family campsites, each equipped with a picnic table and campfire ring. Vault toilets and drinking water are provided. Nearby Attractions: Lake Tahoe is about 30 minutes away and offers excellent boating, kayaking, fishing, hiking and scenic driving opportunities. Stampede Reservoir is a 35-minute drive southeast of the campground. Sardine Lakes within beautiful Lakes Basin is a 40-minute drive northwest, via the Golden Chain/Highway 49.",39.4908333333,-120.243888889,"Camping, Jeep Trails"
ROBINSON CREEK SOUTH,"Overview Robinson Creek South Campground is located just 9 miles from Bridgeport, California, next to Robinson Creek at an elevation of 7,000 feet. The Twin Lakes area is close by, offering boating, fishing, hiking and horseback riding opportunities. Natural Features: The campground is situated alongside its namesake creek, where a forest of massive Jeffrey pines towers over the site, offering partial shade. Lodgepole pines, sagebrush and summer wildflowers dot the landscape. Recreation: Robinson Creek offers good rainbow trout fishing and can be easily accessed from within the campground. Numerous hiking trails are in the vicinity, including the popular Robinson Creek Trail. Facilities: The campground contains single sites with picnic tables, food storage lockers and campfire rings with grills. Vault toilets, drinking water and trash collection are provided. Firewood is available for purchase from the host.  Educational programs are held at the campgrounds amphitheater on weekends from July 4 through Labor Day. Robinson Creek North Campground is adjacent. Nearby Attractions: Upper and Lower Twin Lakes are nearby, offering beautiful mountain scenery, boating, canoeing and fishing for Kokanee salmon and rainbow and brown trout. The rugged and scenic Hoover Wilderness Area can be accessed from the Twin Lakes area and offers additional hiking and horseback riding trails.",38.1861111111,-119.3175,"Camping, Horseback Riding"
EEL CREEK CAMPGROUND,"Overview Eel Creek Campground sits among coastal shrubbery on the edge of the sandy dunes of Oregon Dunes National Recreation Area. Eel Creek attracts campers who plan to do more than off-road vehicle riding during their visit to the dunes.  Hikers and birders are attracted to the peaceful atmosphere of the campground. The most popular trail here is the John Dellenback Dunes Trail, which guides hikers through the scenic dunes to the Pacific beach.     The section of dunes in the Umpqua Dune Area features spectacular heights, and the area is one of the easiest locations for pedestrian beach access. Natural Features: Most sites are secluded and private due to dense shrubbery like rhododendrons and Salal. Sites 7, 8, 42 and 43 are perched on the sand of the dunes. The Oregon Dunes National Recreation Area, in the southern end of Siuslaw National Forest, is known for its wind-sculpted sand dunes towering up to 500 feet above sea level. Recreation: The John Dellenback Dunes Trail takes hikers on a 2.7-mile trek from a conifer forest to private vistas of fresh water lakes like Threemile Lake. The trail finishes at a beach on the Pacific. This hike makes for an incredible workout, due to tall dunes and soft sand. Quality wildlife watching is also a feature of the campground.  Facilities: The campground is divided into a North and South Loop. Amenities include flush toilets, drinking water and a self pay station. A campground host is on hand and an amphitheater sits between the two loops.  Nearby Attractions: Visit Umpqua Lighthouse State Park, along Lake Marie. The Umpqua River Lighthouse stands on the site where the first lighthouse on the Oregon Coast was built in 1857. The current lighthouse dates back to 1890.",43.5830555556,-124.184722222,"Camping, Horseback Riding"
TASHA EQUESTRIAN,"Overview Tasha Equestrian Campground is located in central Utah, just 4 miles north of beautiful Fish Lake at an elevation of 9,000 feet. Visitors enjoy horseback riding and fishing for famous Mackinaw lake trout. Natural Features: Tashas high mountain setting is beautiful but remote and is prone to rapid weather changes due to its elevation. The site is forested with a mixed stand of aspen, spruce and pines, which provides partial shade. Most sites provide sweeping mountain and valley views. Recreation: Many miles of horseback riding, hiking, biking and off-road vehicle trails crisscross the area. Johnson Valley Reservoir is just a half-mile from the campground, offering boating, fishing and a boat ramp.  Facilities: Tasha Equestrian offers a group site with a picnic shelter, as well as single-family sites. Flush toilets and drinking water are provided. Roads and spurs are gravel, but have good access for trailers and trucks.  The camp is fully equipped for campers with horses. Corrals, a staging area, hitching racks and trailheads are located within the facility. Nearby Attractions: Fish Lake, Utahs largest natural mountain lake, is less than 10 minutes from the campground. The lake is famous for its 20-40 pound Mackinaw lake trout. Boating, swimming and scuba diving are popular activities on the lake. Boat ramps, rentals, a marina, fuel, groceries, restaurants and fishing and camping supplies can all be found at Fish Lake.  The Mytoge Mountain Trail, a 25-mile hiking/biking loop, offers everything from easy cruising to challenging singletrack in the mountains around Fish Lake.",38.6236111111,-111.660833333,"Camping, Horseback Riding, Scuba"
BOYKIN SPRINGS RECREATION AREA,"Overview Located on Boykin Springs Lake in Angelina National Forest, this recreation area offers a little of everything, including camping, hiking, fishing, picnicking and relaxing in nature. It is situated in eastern Texas near the Louisiana border.  The facility has both a campground and day-use area. The group shelter must be reserved; the campground is first-come, first-served. Natural Features: Boykin Creek and the nine-acre Boykin Springs Lake both pass through the facility, and the Sam Rayburn Reservoir is nearby. The area is forested with pines and hardwoods. Wildlife is abundant, and the region is a hot spot for migratory birds. Recreation: The group picnic area provides direct access to the Sawmill Trail, a hiking trail that winds through the forest to the Neches River and the Aldridge Sawmill Historical Site. Waters are calm and quiet; only non-motorized boats are allowed. Facilities: The group picnic shelter accommodates up to 74 guests and is available by reservation only. It is adjacent to the hiking trail and creek. The campground has several standard sites for tents and RVs, as well as a few tent-only sites. All campsites are first-come, first-served. Drinking water, flush toilets and hot showers are available at the campground.  Nearby Attractions: The National Forests and Grasslands in Texas have trails for a variety of outdoor activities, including nearly 200 miles of hiking trails, 85 miles of off-road vehicle trails, 145 miles of horse trails and 11 miles of bicycle trails.",31.0518611111,-94.2680388889,"Camping, Horseback Riding"
NORTH CANYON CAMPGROUND,"Overview North Canyon Campground is situated next to Vallecito Reservoir in southwestern Colorado. Visitors enjoy the area for its beautiful scenery and wide range of recreational activities, including boating, fishing and hiking. Natural Features: Vallecito, which is Spanish for ""little valley,"" sits at an elevation of 7,900 feet. Scattered ponderosa pines tower over the open campground, offering limited shade. A thick understory provides privacy between sites, many of which have partial lake views. Thickets of willow separate the camping area from the lakeshore. High peaks of the San Juans are visible to the northwest of the campground.  Recreation: Vallecito Reservoir is a very popular fishing lake, with anglers casting for German brown trout, cutthroat trout, rainbow trout, kokanee salmon and northern pike.  The lake offers great boating, water skiing and canoeing opportunities. Boat rentals and fishing licenses are available at various locations around the lake. A variety of hiking and horseback riding trails are found in the area. The North Canyon Trail begins across the road from the campground and leads through ponderosa pine and aspen forests. A short side trail leads to a scenic overlook of the lake. East Creek Trail begins a quarter-mile northeast of the campground, on Forest Road 852. It provides access to a lightly used, scenic drainage where fly-fisherman cast for brook trout. Both trails are popular with horseback riders, however, horses are not allowed in the campground. Facilities: The campground offers single-family sites, many of which have lake views. Sites are equipped with a picnic table and campfire ring. Vault toilets and drinking water are provided.",37.3938888889,-107.538888889,"Camping, Horseback Riding"
WILD HORSE EQUESTRIAN FAMILY,"Overview The Wild Horse Equestrian Campground is one of a handful that is equipped for corralling horses in the beautiful pine-forested mountains of Southern California. It is strategically located to provide campers with access to a variety of horseback riding trails, as well as the wide open meadows of the San Gorgonio Wilderness. Natural Features: The campground is situated high in the mountains, at an elevation of about 7,000 feet. Surrounding terrain is rocky and steep, but appropriate for both the beginner and intermediate rider. Tall pine trees cover the landscape, providing welcomed shade at the campground. Recreation: A variety of backcountry hiking, biking and horseback riding trails can be found near the campground, including the famed Santa Ana River Trail, which provides miles of scenic mountain views and points of exploration.  It is typically a one-hour loop ride that meanders through the area, but another route off the same trail will lead to a portion of the Pacific Crest Trail, several miles away.   A variety of other trailheads begin near the campground, including Fish Creek Meadow, Mission Creek, Dry Lake and South Fork, among others. Fishing is also available in the numerous nearby mountain streams. Facilities: The campground offers eight single-family campsites and three double campsites, available for tent and RV camping. Some sites are accessible and only campers with horses are allowed to use the campground.  Sites are equipped with tables and campfire rings with grills. Accessible flush toilets, showers and drinking water are provided.   More than two dozen single-horse corrals are provided, as well as a horse watering station, horse staging area and hitching racks. Parking space is limited at the campground. Nearby Attractions: The Big Bear Lake and its adjoining town are located approximately 20 miles from the campground, offering a variety of water-related recreation opportunities, as well as golf, shopping and restaurant options.",34.2019444444,-116.767222222,"Camping, Horseback Riding"
RED CANYON,"Overview Red Canyon Campground is located in a grassy meadow high above Flaming Gorge Reservoir, along Red Canyon Road at an elevation of 7,400 feet. Visitors enjoy exploring the Red Canyon Rim Trail and canoeing and fishing at Greens Lake. Natural Features: The campground lies close to beautiful cliffs overlooking Flaming Gorge Reservoir. Lodgepole and ponderosa pines dot the campground, providing limited shade. Summer wildflowers are plentiful.  Recreation: Nearby Greens Lake offers great canoeing and fishing for rainbow and brook trout. Red Canyon Lodge sits on the shore. Canoe and bike rentals, horseback riding, a restaurant and gift shop are available. Red Canyon Rim Trail, for hiking and biking, begins at the nearby visitor center, which offers interpretive displays and area information. Facilities: This small campground contains family campsites with picnic tables and campfire rings. Vault toilets and drinking water are provided.  Nearby Attractions: Flaming Gorge National Recreation Area is known not only for its beautiful red cliffs, but also for its world-class fishing for lake, brown and rainbow trout. Boating, water skiing, jet skiing, canoeing, kayaking, swimming and scuba diving are popular activities on the reservoir. Flaming Gorge Dam offers guided tours of the working hydroelectric plant and the dam itself; The adjacent visitor center contains area history exhibits. The Green River below the dam provides spectacular rafting opportunities. A trip down the river offers unique geology, outlaw history and Native American rock art.",40.8894444444,-109.559166667,"Camping, Horseback Riding, Scuba"
FENSKE LAKE CAMPGROUND,"Overview Fenske Lake Campground offers visitors an escape to a small, remote campground with large, majestic pine trees and easy access to water. It is a popular base camp for exploring, fishing, hiking, sightseeing and backcountry canoeing in Superior National Forest and the nearby Boundary Waters Canoe Area Wilderness. The campground lies approximately 10 miles outside of Ely, Minnesota. Natural Features: The facility overlooks 130-acre Fenske Lake, a small and scenic body of water surrounded by dense hardwood and pine forests in the northwoods of Minnesota. Birds and wildlife are abundant in the area. Superior National Forest, located in northeastern Minnesotas Arrowhead Region, is comprised of 3-million acres. The forest spans 150 miles along the United States-Canada border.  Recreation: Because of its proximity to access points into the Boundary Waters Canoe Area Wilderness and its status as a Superior National Forest canoe circle route, Fenske Lake is very popular for canoeing and kayaking. Canoe rentals are available from the campground concessionaire with a days notice. Families and children enjoy exploring the short, 1-mile nature trail in the campground, as well as swimming at the grassy beach or waiting for a catch on the accessible fishing pier. Anglers can make use of the boat ramp and try their luck for bass, northern pike, crappie and sunfish. View  recreation guides and maps  of hiking trails and canoe routes in the national forest. Facilities: The campground is tent-friendly; most sites do not accommodate large RVs. Sites are spaced widely apart along a large loop. All sites have partial to full shade, and some overlook the lake. A group campsite for 10 to 25 people is situated on a separate parking spur away from the main campground. The site is perched high on a rock ledge overlooking the lake, offering a spectacular view. Families and groups of friends will enjoy the facilitys small picnic area. An open log shelter is available for use during inclement weather. Nearby Attractions: Numerous outdoor recreation opportunities lie within Superior National Forests 77 lake accesses, 13 fishing piers, 10 swimming beaches and 22 picnic areas. The forest is also home to three scenic byways. Campers can also explore the nearby Boundary Waters Canoe Area Wilderness. Over 1-million acres in size, the Boundary Waters extends nearly 150 miles along the United States-Canada border and contains over 1,200 miles of canoe routes, 12 hiking trails and over 2,000 designated campsites. Additional sites of interest",47.9952777778,-91.9138888889,"Camping, Jeep Trails"
WILLOW FLAT CAMPGROUND,"Overview Willow Flat is a popular campground, located on the banks of the Cub River, in southeastern Idaho. It sits in a pretty valley, surrounded by scenic mountain views, at an elevation of 6,300 feet. Visitors enjoy fishing the river and exploring numerous forested trails. Natural Features: A mixed forest of pines, spruce and hardwoods provides partial shade and beautiful scenery. The banks of the Cub River are lined with dense stands of willow, a favorite food of local moose. Deer and elk are often seen in the area as well. Recreation: The Cub River provides great fishing for wild cutthroat and hatchery rainbow trout. Numerous trails begin within the campground, including a 1/2-mile nature trail to Sam Parkinson Spring.  The multi-use Cub River Trail also begins at the campground, offering great hiking, mountain and dirt biking, as well as off-road vehicle and horseback riding. The trail accesses the Highline Trail, the North Fork of St. Charles Creek and the Cub River Guard Station. Facilities: This large campground contains six group campsites than can accommodate 24 to 100 people. Numerous single-family campsites are available at the campground as well. Some single and group sites have picnic shelters. A few single sites must be accessed via footbridges over the river from the parking spur.  Amenities available at the campground include vault toilets and drinking water. An amphitheater with bleacher seating and a cement platform is located at group site G03. Roads and parking spurs within the campground are gravel.",42.1394444444,-111.625277778,"Camping, Horseback Riding"
