name,description,latitude,longitude,category
SHEEP BRIDGE,"Overview Situated in Deschutes National Forest, Sheep Bridge Campground offers visitors stunning scenery in Oregons eastern Cascade region and easy access to an abundance of recreational activities. Located on the banks of the Deschutes River and in close proximity to several wilderness areas, this campground offers a quiet and serene outdoor experience. Natural Features: Many of the campsites offer sweeping views of Deschutes River, a major tributary of the Columbia River.  Providing drainage for most of the eastern side of the Cascade range in Oregon, The Deschutes River flows from its headwaters at Little Lava Lake through rugged country comprised of towering coniferous forests and volcanic landscapes.  The surrounding undeveloped wilderness, clean streams and diverse forests support an abundance of wildlife, including bighorn sheep, deer, native fish and migratory birds. Recreation: Hiking and fishing top the list of recreational activities for visitors to Sheep Bridge. For anglers, the Deschutes river offers a stunning setting for fly-fishing. Its clear, cold water also supports rainbow trout, whitefish, bull trout and kokanee salmon. For day hikers and backpackers, the area offers a wide variety of scenic terrain, ranging from riverside trails to routes in diverse coniferous forests. Facilities: Sheep Bridge Campground has 23 large, isolated sites that accommodate both tent and RV camping, however hookups are not available.  Picnic areas, firewood, drinking water and flush toilets give visitors the opportunity to enjoy the outdoors while still having many of the conveniences of home.   A boat ramp for river access is also available at the campground. Nearby Attractions: Visitors can explore wilderness areas, rivers, lakes, reservoirs, and approximately 1,600 miles of trails that comprise nearly 2.5 million acres the Deschutes National Forest and the adjacent Ochoco National Forest. Lava Lands Visitor Center in nearby Bend, Oregon, and the Newberry National Volcanic Monument are also popular attractions. Visitors will also enjoy traveling the Cascade Lakes Scenic Byway, known as Oregons Highway in the Sky, which climbs into the clouds on a 66-mile drive through the Cascade Mountain range, weaving through snow-capped peaks and alpine lakes.",43.7344444444,-121.788888889,"Camping, Jeep Trails"
FORT PICKENS CAMPGROUND,"Overview Fort Pickens Campground is situated on Santa Rosa Island, a part of the Gulf Islands National Seashore south of Pensacola and Gulf Breeze, Florida. Visitors enjoy the seashore for its great recreational activities, historic sites and unique white sand beaches. Natural Features: The campground is located on a barrier island between the Gulf of Mexico and Pensacola Bay. Groves of live oak trees are scattered across the island, providing shelter for resident and migrating bird populations, as well as shade for park visitors.  The Gulf Islands National Seashore is home to sparkling blue waters, white beaches and coastal marshes. However, more than 80% of the national park is underwater, as its a vital protective habitat to marine life. Recreation: Many visitors young and old come to Fort Pickens to enjoy its scenic location on the beach. The white sands of Santa Rosa Island are the perfect place for a long walk or an afternoon of building sandcastles. The warm ocean waters are great for swimming and snorkeling. Fishermen will find a pier just a short distance from the picnic pavilions. It can be used by visitors without a Florida fishing license. Many hiking trails through the sand dunes provide beautiful views and hours of exploration.  Historic Fort Pickens, a pentagonal fort built to defend Pensacola Bay in 1834, is just 1 mile from the campground. The structure was fortified after the War of 1812 and was one of four forts in the South never occupied by Confederates during the Civil War. Facilities: This large campground is open for reservations year-round. It contains 180 family sites with electric and water hookups. A group site with water hookup is also available. Amenities include flush toilets, showers, drinking water and a dump station. There are no boat ramps in the Fort Pickens area. Nearby Attractions: The campground is a short distance from restaurants and beach nightlife, downtown Pensacola, the Pensacola Naval Air Station and Naval Aviation Museum, the Pensacola Lighthouse and other historic sites. Campsites are within 1/4 mile of the beaches of the Emerald Coast of the Gulf of Mexico and Pensacola Bay.",30.3197222222,-87.2702777778,"Camping, Jeep Trails"
DORIS CREEK CAMPGROUND,"Overview Doris Creek Campground is located high in the Rocky Mountains, west of the Continental Divide and just south of the Canadian border.  Spectacular views and ample opportunities for recreation surround the campground. Natural Features: The campground is situated along the massive Hungry Horse Reservoir, which was dammed to provide hydroelectric power and flood control to the area.  It is the 10th highest dam in the United States and provides a stunning backdrop.  Home to lynx, grizzly bear and bull trout, the forest is a premiere destination for visitors. Recreation: Boating is popular on the 27,750-acre reservoir, and a concrete boat ramp is accessible from within the campground.  Swimming and fishing are also popular pastimes, and anglers can expect to catch a variety of fish, including cutthroat trout. Facilities: The campground offers 10 overnight sites for tent and RV camping.  Each is equipped with tables and campfire rings with grills. There is no water at this campground.  Please bring your own drinking water. An accessible vault toilet is provided.  Campground roads and parking spurs are gravel.  Campground host is available at the Doris Boat Launch to answer any questions about the campground and surrounding area.  The campground also offers first-come, first-serve sites as well. Nearby Attractions: Doris Creek Campground is approximately 14 miles southwest of the West Glacier entrance to Glacier National Park.",48.3052777778,113.980555556,"Camping, Horseback Riding"
LOST JOHNNY POINT CAMPGROUND,"Overview Lost Johnny Point Campground is located high in the Rocky Mountains, west of the Continental Divide and just south of the Canadian border.  Spectacular views and ample opportunities for recreation surround the campground. Natural Features: The campground is situated along the massive Hungry Horse Reservoir, which was dammed to provide hydroelectric power and flood control to the area.  It is the 10th highest dam in the United States and provides a stunning backdrop.  Home to lynx, grizzly bear and bull trout, the forest is a premiere destination for visitors. Recreation: Boating is popular on the 27,750-acre reservoir, and a concrete boat ramp is accessible from within the campground.  Swimming and fishing are also popular pastimes, and anglers can expect to catch a variety of fish, including cutthroat trout. Facilities: The campground offers 21 overnight sites for tent and RV camping.  Each is equipped with tables and campfire rings with grills.  Accessible vault toilets and drinking water are provided.  Campground roads and parking spurs are paved.  An on-site host is available to answer any questions about the campground and surrounding area.  The campground also offers first-come, first-serve sites as well. Nearby Attractions: Lost Johnny Point Campground is approximately 18 miles southwest of the West Glacier entrance to Glacier National Park.",48.3102138889,-113.962608333,"Camping, Horseback Riding"
Cable Mountain Campground,Cable Mountain Campground is located on 5 wooded acres.,46.221898,-113.246813,"Camping, Horseback Riding"
Twin Ponds CUA Dispersed,Dispersed Camping Area,38.786957,-111.641733,"Free Camping, Horseback Riding"
Kroeger Campground,"Kroeger Campground is located in La Plata Canyon, with 10 campsites on 2 shaded acres. You can fish in the nearby La Plata River, but success rates are only fair. Expect cool summer nights at this elevation. There is no trash pickup; trash must be packed out. Most sites do not accommodate larger RVs. Private property is adjacent to the campground - do not trespass.",37.3762,-108.0771,"Camping, Horseback Riding"
Lower Eightmile Crossing Campgro,"This is a very primitive campground, which receives minimal maintenance. Little Badger Campground is situated just outside of the  Badger Creek Wilderness  along Little Badger Creek.",45.41361,-121.44371,"Camping, Horseback Riding"
Carter Bridge Campground,"On the Wild and Scenic Clackamas River. The campground is a compact single loop through cedars, maples, and alders. A couple of berry patches suggest good picking in late-summer. Some of these sites have great views of the river. Recreation activities include fishing and whitewater rafting.",45.16821,-122.15728,"Camping, Horseback Riding"
Riverford Campground,"Riverford Campground is a small scenic campground, along the Clackamas River near its confluence with the Collowash River set in a dense forest of Douglas fir and hemlocks. Located on the Wild and Scenic Clackamas River.",45.032661,-122.058231,"Camping, Horseback Riding"
Triangle Lake Horse Camp,"Triangle Lake Horse Camp is located on the south end of Triangle Lake in the Olallie Scenic area. While the lake is not visible from most camp sites, it is just a short walk or ride down the hill to the Lake. This campground offers tranquil sites in a setting of lodgepole pines and mountain hemlocks. Long gravel parking pads accommodate both camp vehicles and horse trailers. A variety of trails are open to horse riding. Other recreational activities include fishing and hiking.",44.851019,-121.775511,"Camping, Horseback Riding"
Black Lake Campground,Hood River Ranger District,45.6149,-121.759,"Camping, Horseback Riding"
Lost Lake Campground,"This campground, in a great location proximal to Lost Lake, provides beautiful views of Mt. Hood and access to the Lost Lake Resort's store and boating equipment. 148 campsites available with campground pit toilets and near a public boat launch. The area is wheelchair accessible particularly to the fishing dock. 2 miles of wheelchair accessible trails No electrical hookups but R. V. dump & fill is available to R. V. campers. There are a number of RV spaces in D loop that will accept a 40 RV.",45.5008,-121.81641,"Camping, Horseback Riding"
Horseshoe Hole Campground,"The Horseshoe Hole dispersed camping area is situated at the end of a timber road in the Staney Creek watershed and offers two campsites. It is only a quick walk through the woods to Horseshoe Hole on Staney Creek from either of the two campsites. Each site has a hardened tent site, a fire ring, and a picnic table. No outhouses are available. The area provides visitors with miles of roads, excellent fishing on the creek and its tributaries, hunting opportunities, and great berry picking. There are lots of opportunities to view wildlife at Horseshoe Hole. The site has no fee and is first-come, first -served. Stay limit is 14 days.",55.814417,-133.129694,"Camping, Free Camping, Jeep Trails"
Pipeline Trailhead,"The Pipeline Trail is 3.1 miles long. It begins at Connell Lake Road and ends at Jct. With Tongass Hwy. The trail is gravel-surfaced with rolling terrain providing flat and easy to hike sections with a few steeper inclines.  It has been designated as an accessible trail meeting all accessible standards.  It provides a link between the campgrounds and day use areas within the Ward Lake complex with the Last Chance Campground, and four other trails; the Ward Lake Trail, Connell Lake Trail, Perseverance Trail and the Salvage Interpretive Trail.",55.42239,-131.69684,"Camping, Jeep Trails"
Nemo Campsites Entry & Info Site,"Entry and Information site for the Nemo Campsites on Wrangell Island. Site is occupied by Wrangell Island Host Volunteers, and used for evening campground programs in the summer months. Available for camping when not occupied by island hosts. Information boards provide posted information for the public.",56.305833,-132.347778,"Camping, Jeep Trails"
Mouth of Laurel Boat Ramp,"\n The Mouth of Laurel Boat Ramp is located at the confluence of  Laurel River  and  Lake Cumberland . \n View  Mouth of Laurel Boat Ramp Map \n Lake Cumberland is located in Wayne, Russell, Pulaski, Clinton, McCreary, Laurel and Whitney counties in Kentucky on the Cumberland River. The dam site is at river mile 460.9 or about 10 miles southwest of Jamestown, Kentucky. The Wolf Creek project was authorized by the Flood Control Act of 1938 and the River and Arbor Act of 1964. Operation of the lake is for the primary purpose of flood control and production of hydroelectric power. The dam, powerhouse, and the lake are operated and supervised by the U.S. Army Corps of Engineers. \n Trails nearby: \n \n Sheltowee Trace  Section 26 \n Sheltowee Trace Section 27 Flood Route for Sheltowee Trace #100A \n \n",36.94401037,-84.29530276,"Cabins Overnight, Canoeing, Diving, Fire Lookouts, Fishing, Horse Camping, Hunting, Interpretive Programs, Off Highway Vehicle, Recreational Vehicles, Rock Climbing, Swimming, Visitor Center, Wildlife Viewing"
Alfrey Boat Ramp,"Alfrey Boat Ramp is located on  Cave Run Lake on the  Cumberland Ranger District  of the Daniel Boone National Forest. \n Cave Run Lake is nestled among the beautiful mountains of eastern Kentucky. Built by the  U.S. Army Corps of Engineers , this 8,270 lake provides flood protection to the lower Licking River valley and supplies water to area communities, improves water flow conditions on the Licking River, and offers habitat for many species of fish and wildlife. The lake is known for its excellent muskie fishing. \n \n \n Boat Ramps on Cave Run Lake \n Cave Run Lake area map \n \n You must comply with all regulations established by the Kentucky Department of Fish and Wildlife Resources  concerning fishing, boating and waterway safety laws. Licenses and regulation guides are available at most retail stores.",38.091375,-83.498024,"Cabins Overnight, Canoeing, Diving, Fire Lookouts, Fishing, Horse Camping, Hunting, Interpretive Programs, Off Highway Vehicle, Recreational Vehicles, Swimming, Visitor Center, Wildlife Viewing"
McKay Crossing Campground,"Mckay Campground is located off the beaten path along Paulina Creek.It provides campers with seclusion from the main road and the tranquility of hearing the creek flow.This area is good for bird watching, particularly in the wetlands located west of the campground.",43.7157,-121.3774,Camping
Trappers Lake / Bucks Campground,"Bucks Campground at Trappers Lake has 10 sites. It sits very near the Wilderness boundary, close to the Trappers Lake Outlet parking area.",39.993912,-107.239521,Camping
Vail Pass / Tenmile Canyon Natio,"The Vail Pass / Tenmile Canyon National Recreation Trail begins at Gore Creek Campground and ends at Copper Mtn: This paved trail starts where Bighorn Road ends, follows what used to be old Highway 6 over Vail Pass, and then descends to Copper Mountain. It is a popular biking trail, so be careful to stay on the right side of the trail as bikers descend toward you.",39.626201,-106.275237,Camping
Elk Wallow Campground,"7 campsites. This campground is most suited for guests looking for a quiet, relatively primitive setting. No hook ups available. Camping units for autos, pickup campers, tents, and small trailers. One vault type toilet. Camping units have tables, firerings, and parking spurs. Campground roads are not paved. Drinking water is not available. No reservations - ""first come first served"" Fishing in North Fork Mormon Creek. Attractions & Considerations Nearest Services : Gas Station - Basalt Grocery Store - Basalt Dump Station - Ruedi Campgrounds Drug Store - Basalt Physician - Basalt Hospital - Glenwood Springs/Aspen Church - Thomasville/Basalt",39.343943,-106.613718,Camping
Spoon Creek Falls Trailhead,Small roadside parking area. Potable water and flush toilets are available at  Coho Campground  when open during the summer season. Provides access to:   Spoon Creek Falls Trail #885,47.354741,-123.567014,Camping
Lost Johnny Campground,"3600-foot elevation. 5 sites near the west shore of Hungry Horse Reservoir. Fishing for trout and whitefish in the reservoir; waterskiing, sailing, and motorboating are also popular. For landlubbers, head 9 miles west into the exceptionally lovely Jewel Basin Hiking Area. Campsite Reservoir access View of Reservoir",48.30685,-113.96964,Camping
Flat Rock Campground,"This campgroundoffers campingadjacent tothe Yankee Fork of the Salmon River. Fishing for rainbow trout in the river, and interpretive and historical tours is available nearby. Facilities at each of the 6 sites include picnic tables, fire pits with cooking grills. Campground amenities include a vault toilet, hand pump for drinking water but no full hookups. Sites accomodate trailers and motorhomes up to 32 feet long.",44.2908762,-114.7167283,Camping
Secesh Horse Camp,This campground is a 5 unit campground open for recreational users with stock.  Hitchrails at all the units are available to tether stock.  Campsites are adjacent to the Secesh River.  Trail access to #080 trail.  No hook-ups.,45.0718848,-115.78912,Camping
Huckleberry Campground,This is a popular 8 unit campground located along a small creek suitable for fishing. Large Ponderosa Pine and Douglas Fir shade the areas during the day. No hook-ups.,45.0839027,-116.61626,Camping
Secesh River Trailhead,Located adjacent to the Secesh Horse Campground on Lick Creek Road,45.0718848,-115.78912,"Camping, Horseback Riding"
Lake Creek Campground,Lake CreekCampgroundcontainssixsiteswith Lake Creek flowing near the campground. 16-day stay limit Water: Not available This site is not accessible to persons with mobility impairments No cell service Notes: Maximum spur 22 feet,44.92163,-109.70696,Camping
Dickinson Creek Campground,"The Dickinson Creek Campground has 15 campsitesand is located near the boundary of the Popo Agie Wilderness. No trailers over 20 feet long. Amenities include two vault toilets, picnic tables and cook grates. Potable water is not available. From this campground, there are several trails that lead into the Popo Agie Wilderness and to many mountain lakes, the largest being Shoshone Lake. Neaby Wind River Indian Reservation lands are private-- please be respectful of the private land boundaries and do not trespass. To cross tribal lands you and everyone in your party must purchase tribal fishing licenses.",42.83602,-109.05765,Camping
Jake Best Campground,"Jake Best is one of twodeveloped campgrounds on Citico Creek, and is used as a hub for trout fishermen and hunters alike. Each site contains a picnic table, grill/fire ring, and lantern post. Jake Best has a campground host during peak season occupying one site of the campground.",35.446513,-84.112355,Camping
North Fork Slate Creek Campgroun,"The North Fork Campground consists of five campsites, picnic tables and firerings located at the confluence of Slate Creek and its North Fork. Hikers as well as mountain bikers can enjoya number of loop trails in the area. Parking is suitable for up to five vehicles. Small tent/travel trailers can be utilized as can self-contained pickup campers and motor homes.",45.64258,-116.11388,Camping
Windy Saddle Campground,"Located in the foothills of the Seven Devils Mountains, the Windy Saddle Campground offers backpackers, hikers and outdoor enthusiasts6 tent sites with access to many amazing trails leading into the Wilderness.",45.883,-115.0423,Camping
Hidden Creek Campground,"Tucked away in groves of old growth cedar trees and adjacent to the stunning North Fork of the Clearwater River in northwest Idaho, rests a hidden gem: Hidden Creek Campground. With 13 sites, one group tent camping pad, many fishing opportunities and nearby hiking trails, Hidden Creek Campground has proved to be a favorite for many visitors looking to camp out in a place that truely feels encased in nature and her many delights.",46.8317242786,-115.179114436,Camping
Isabella Point Trailhead,"The Isabella Point Trailhead serves as the beginning to trail 95 which connects to trail 399, taking hikers on a journey into the spectacular Mallard Larkins Pioneer Area. Two campground units are located at the trailhead.",46.8918319312,-115.59739933,Camping
Big Bend Campground,"This campground is located on a sagebrush and open conifer forest flat adjacent to the Cache La Poudre River. There are eight sites available, including three walk-in tent sites. Facilities provided include a restroom and drinking water. Each site contains a tent pad, fire grate, and picnic table. Primary recreation opportunities in the area include fishing, hiking and wildlife viewing. There is a bighorn sheep viewing station along the entrance road to the campground.",40.7104152295,-105.726567282,Camping
Long Draw Campground,Long Draw Campground is situated near Long Draw Reservoir. Long Draw has 25 sites including three double sites. Each site has a picnic table and fire grate. There are two restrooms and one water hydrant which is near the campground entrance. Popular activities in the area include reservoir and stream fishing and hiking.,40.5154022151,-105.768031198,Camping
Brown Creek Campground,Dispersed Camping Area,34.18596667,-109.78965,"Camping, Free Camping"
Strayhorse Campground,"The campground is set among large ponderosa pine and Gambel oak.Just six miles below the Mogollon Rim, it provides a cool shady site for picnics or camping.",33.55028611,-109.3176556,Camping
Sinkhole Campground,"Located in the ponderosa pine forest, this campground is within walking distance of Willow Springs Lake which provides boating and fishing opportunities. Hiking and mountain biking opportunities are nearby in the non-motorized Wildlife Area. The General Crook National Recreation Trail is also within a mile of the campground. Be prepared for rain, often heavy, through July and August. Expect cool to cold nighttime temperatures. For a map of this campground, click here.",34.30561389,-110.8862722,Camping
Rim Campground,Rim is situated close to the edge of the Mogollon Rim. Spectacular 100 mile views are seen from many vantage points along the rim.,34.30558889,-110.9082861,Camping
Blodgett Campground,"Blodgett Campground consists of 5 campsites, 1 walk-in site, plus 1 host site, complete with picnic tables, fire rings, and a vault toilet. There are two accessible campsites. The campground rests under the towering cliff faces of Blodgett Canyon which are very popular to rock climbers. Blodgett Canyon Picnic Area is across Blodgett Creek. Campground can accommodate RV's or trailers to 45 feet.",46.269922,-114.244263,Camping
Blodgett Trailhead,"Blodgett Trailhead is located adjacent to the Blodgett Campground. It has adequate parking for both cars and trailers. It offers access to Blodgett Trail #19 to Blodgett Lake, Blodgett Pass and Trail #303 to High Lake, and the Selway-Bitterroot Wilderness. Facilities include hitching rails and a vault toilet.",46.268617,-114.243181,Camping
Applebury Boating Site,This site is an undeveloped boat launch site on the West Fork of the Bitterroot River.  Parking is located a couple hundred feet from the site and dispersed camping is available nearby.,45.8272,-114.2346,Free Camping
Paradise Boating Site,Paradise Boating site is a developed boat launch and the main entry to Selway river. It is located approximately 1/2 mile from Paradise Campground.,45.860558,-114.744224,Camping
Copper Creek Campground,This campground is located northeast of Lincoln. Snowbank Lake is located across the road from the campground. The campground is only a short two mile drive from the Indian Meadows Trailhead and access into the Scapegoat Wilderness.,47.07833333,-112.6194444,Camping
Handy Springs Campground,This campground offers one tent-only site.,47.97888,-120.412277,Camping
Moore Point Campground,"This boat-in campground offers a picnic shelter and a fixed dock with a three boat capacity. There are four tent sites with a lot of room for additional dispersed camping, four picnic tables, four fire rings and two vault toilets available.",48.234823,-120.616566,"Camping, Free Camping"
Safety Harbor Campground,"This boat-in campground offers a floating dock with a six boat capacity. There are four tent sites, two fire rings, two tables, and one vault toilet. This site has year round access and is a good shelter from both up and down lake winds.",48.048628,-120.377672,Camping
Lost Lake Camping Area,"Situated next to Lost Lake this area offers dispersed camping with limited space. No amenities, Self-service. Popular fishing in the spring.",46.639375,-121.068933,Free Camping
Lone Fir Campground,"This forested campground, surrounded by nearby mountains, is located along Early Winters Creek on Highway 20. This campground has beautiful mountain views, access to  Lone Fir Trail 535  and is near  Cuttthroat Creek Trail 483 . Good overnight spot for bicyclists. Next campground westbound is located at Diablo Lake.",48.5813,-120.624,Camping
South Fork Campground,"Located 31 miles west of Augusta, the South Fork offers 7 campsites with opportunities to fish and hike.",47.50111111,-112.8880556,Camping
Dixie Campground,"This is a great destination for berry picking, it is also a wonderful base camp for anyone wanting to hike, hunt or just explore the Malheur National Forest. The  Sumpter Valley Interpretive Trail ,  Davis Creek Trail  as well as other great recreational activities are just a short drive from the campground.",44.534823,-118.5879,Camping
